{
  "$schema": "hermes://b05/row-decisions-schema/v3",
  "schema_version": "2A",
  "manifest_id": "hermes-v0.20-row-decisions",
  "baseline_commit": "dd71c1cb51b1bfc85484a44d939c6f66f88d3eb8",
  "denominator_path": "kit/mapping/neutral-requirements.json",
  "denominator_sha256": "3b28dac2ef24d463917e4e11bdd4e200aff42568d93e5cc28b4f2496209f143f",
  "requirement_count": 318,
  "decisions": [
    {
      "decision_id": "B05-DEC-0001",
      "requirement_key": "kit-lifecycle-readme-md--six-stage-deployment-lifecycle--0001",
      "requirement_digest": "6eb92b7660125a4b4ea5f9a73ea17f6a927f4f02f663c86116b44a1ae56fe8a2",
      "adjudication_state": "pending"
    },
    {
      "decision_id": "B05-DEC-0002",
      "requirement_key": "kit-lifecycle-readme-md--six-stage-deployment-lifecycle-ordered-procedure-and-dependencies--0001",
      "requirement_digest": "0f18f42c368ad2feed41a15783d72596831a58f13859f4b106c8a8cd4077f212",
      "adjudication_state": "pending"
    },
    {
      "decision_id": "B05-DEC-0003",
      "requirement_key": "kit-lifecycle-readme-md--six-stage-deployment-lifecycle-common-rules--0001",
      "requirement_digest": "ebb5dc79f4ecffc9f9247fe956809c346e1b2978e5b1c0e81d41496f0a4215b1",
      "adjudication_state": "pending"
    },
    {
      "decision_id": "B05-DEC-0004",
      "requirement_key": "kit-lifecycle-readme-md--six-stage-deployment-lifecycle-common-rules--0002",
      "requirement_digest": "3795ead197c55a60ecf35da1035289177d82bdc103df0dba9538b6f0e4173965",
      "adjudication_state": "pending"
    },
    {
      "decision_id": "B05-DEC-0005",
      "requirement_key": "kit-lifecycle-readme-md--six-stage-deployment-lifecycle-common-rules--0003",
      "requirement_digest": "899690561cb015ab13e3eee73a2e7c2c2dc343642f391dc6ab4c96730fb7e65e",
      "adjudication_state": "pending"
    },
    {
      "decision_id": "B05-DEC-0006",
      "requirement_key": "kit-lifecycle-01-qualify-md--stage-1-qualify-entry-conditions--0001",
      "requirement_digest": "696c8ab3f2aeb0539e4769c1bedaa3415f195d906e52dfafcd67d9479e3a769e",
      "adjudication_state": "pending"
    },
    {
      "decision_id": "B05-DEC-0007",
      "requirement_key": "kit-lifecycle-01-qualify-md--stage-1-qualify-required-questions--0001",
      "requirement_digest": "98bc564834806cc9ce01a477d382308914c82fdc9c953e95fb64a77db966516d",
      "adjudication_state": "pending"
    },
    {
      "decision_id": "B05-DEC-0008",
      "requirement_key": "kit-lifecycle-01-qualify-md--stage-1-qualify-required-questions--0002",
      "requirement_digest": "14c8dbd6b3d7d124dc9a7230fd6cc01324addb6ceeac8c267b833cd67bbe9fec",
      "adjudication_state": "pending"
    },
    {
      "decision_id": "B05-DEC-0009",
      "requirement_key": "kit-lifecycle-01-qualify-md--stage-1-qualify-required-questions--0003",
      "requirement_digest": "205e7a98af676a280094700dfbb754d20c7fe284970f2a5fc86479a07defc10a",
      "adjudication_state": "pending"
    },
    {
      "decision_id": "B05-DEC-0010",
      "requirement_key": "kit-lifecycle-01-qualify-md--stage-1-qualify-required-questions--0004",
      "requirement_digest": "475e1df3d6959054afba64ae9c438f7309953abf83b3e991c66ecb6dd04efbfe",
      "adjudication_state": "pending"
    },
    {
      "decision_id": "B05-DEC-0011",
      "requirement_key": "kit-lifecycle-01-qualify-md--stage-1-qualify-required-questions--0005",
      "requirement_digest": "c70a5d9120239136f0356ead20285fb00767e59887c0cc7b3deaf700adad2f94",
      "adjudication_state": "pending"
    },
    {
      "decision_id": "B05-DEC-0012",
      "requirement_key": "kit-lifecycle-01-qualify-md--stage-1-qualify-required-questions--0006",
      "requirement_digest": "8fb7bbce7003aa50f155b5c573665d41d2e73f9722921843e29d9db0c4f88183",
      "adjudication_state": "pending"
    },
    {
      "decision_id": "B05-DEC-0013",
      "requirement_key": "kit-lifecycle-01-qualify-md--stage-1-qualify-required-questions--0007",
      "requirement_digest": "8282f3941e46383695d814a18db42a26065a08e5902114e3facef4f6bc996231",
      "adjudication_state": "pending"
    },
    {
      "decision_id": "B05-DEC-0014",
      "requirement_key": "kit-lifecycle-01-qualify-md--stage-1-qualify-decision-rules--0001",
      "requirement_digest": "037ada4a11b413f107138120bbf1f52ecab90a15c1f8dc53b3dd679a77716214",
      "adjudication_state": "pending"
    },
    {
      "decision_id": "B05-DEC-0015",
      "requirement_key": "kit-lifecycle-01-qualify-md--stage-1-qualify-decision-rules--0002",
      "requirement_digest": "a98aced2244f9a0d213ab249648f74187487bad56b5148380121fac15e1e6c1d",
      "adjudication_state": "pending"
    },
    {
      "decision_id": "B05-DEC-0016",
      "requirement_key": "kit-lifecycle-01-qualify-md--stage-1-qualify-decision-rules--0003",
      "requirement_digest": "47f70dd469a18c67d4f907819d7965b4c20d362a537a9ff676d1001945421e29",
      "adjudication_state": "pending"
    },
    {
      "decision_id": "B05-DEC-0017",
      "requirement_key": "kit-lifecycle-01-qualify-md--stage-1-qualify-decision-rules--0004",
      "requirement_digest": "404d4fb62c11676291ba1c197972ee91f203f1174b4c499b437af8642d3de4dc",
      "adjudication_state": "pending"
    },
    {
      "decision_id": "B05-DEC-0018",
      "requirement_key": "kit-lifecycle-01-qualify-md--stage-1-qualify-decision-rules--0005",
      "requirement_digest": "023d46d029c82af7fbba1f28edccd7529255d389082267ae2116c32fd8d36902",
      "adjudication_state": "pending"
    },
    {
      "decision_id": "B05-DEC-0019",
      "requirement_key": "kit-lifecycle-01-qualify-md--stage-1-qualify-accountable-owner--0001",
      "requirement_digest": "4d7190870e8f0e6ca12f782df34cc579ebb244d663b1f01cd1305d96acc872d1",
      "adjudication_state": "pending"
    },
    {
      "decision_id": "B05-DEC-0020",
      "requirement_key": "kit-lifecycle-01-qualify-md--stage-1-qualify-exceptions-and-escalation--0001",
      "requirement_digest": "8d0f57d99208177e95630e328fd2736931f77657c0464060dbff87547fad7bc7",
      "adjudication_state": "pending"
    },
    {
      "decision_id": "B05-DEC-0021",
      "requirement_key": "kit-lifecycle-01-qualify-md--stage-1-qualify-exit-gate-and-acceptance-tests--0001",
      "requirement_digest": "439f32d1cbfb97ec55a324e5f400a1bb427da36be36742c8c12aed86d11b6e75",
      "adjudication_state": "pending"
    },
    {
      "decision_id": "B05-DEC-0022",
      "requirement_key": "kit-lifecycle-01-qualify-md--stage-1-qualify-exit-gate-and-acceptance-tests--0002",
      "requirement_digest": "6011857a74b0b78a22d07630a1cc727a117afec3615ec639037bca32e84eaaed",
      "adjudication_state": "pending"
    },
    {
      "decision_id": "B05-DEC-0023",
      "requirement_key": "kit-lifecycle-01-qualify-md--stage-1-qualify-exit-gate-and-acceptance-tests--0003",
      "requirement_digest": "2c2487cb5a391969906ef6decc6302ea53862f6cd15ee5ed446db6d068582da3",
      "adjudication_state": "pending"
    },
    {
      "decision_id": "B05-DEC-0024",
      "requirement_key": "kit-lifecycle-01-qualify-md--stage-1-qualify-exit-gate-and-acceptance-tests--0004",
      "requirement_digest": "dbb7f03edb9868e9987083e73cca8b9deceb6724a532d7652bd4f7a5996dfe9a",
      "adjudication_state": "pending"
    },
    {
      "decision_id": "B05-DEC-0025",
      "requirement_key": "kit-lifecycle-01-qualify-md--stage-1-qualify-exit-gate-and-acceptance-tests--0005",
      "requirement_digest": "6a4e6877dff7e30c7debb579eaf98f54c934e2a80d018ac38e24cfd7b53015a7",
      "adjudication_state": "pending"
    },
    {
      "decision_id": "B05-DEC-0026",
      "requirement_key": "kit-lifecycle-01-qualify-md--stage-1-qualify-exit-gate-and-acceptance-tests--0006",
      "requirement_digest": "cb8072fa30b243d87405c61485b80f44d838e40f31f0466ff72dc91673146675",
      "adjudication_state": "pending"
    },
    {
      "decision_id": "B05-DEC-0027",
      "requirement_key": "kit-lifecycle-01-qualify-md--stage-1-qualify-exit-gate-and-acceptance-tests--0007",
      "requirement_digest": "bb7381de4ffd34bfb3d8eef6b0121a00b460d83ffcb87837cbc3e78dc35cb153",
      "adjudication_state": "pending"
    },
    {
      "decision_id": "B05-DEC-0028",
      "requirement_key": "kit-lifecycle-02-map-md--stage-2-map-required-questions--0001",
      "requirement_digest": "a1b76e263859a71cdbdc83534cadaf8667b32dd49c42c5f1e5dcc2b7de93c3a6",
      "adjudication_state": "pending"
    },
    {
      "decision_id": "B05-DEC-0029",
      "requirement_key": "kit-lifecycle-02-map-md--stage-2-map-required-questions--0002",
      "requirement_digest": "e90fefc62cb6668bf80e88cb4ab3e4f18c1f032957210f2847a514402f639261",
      "adjudication_state": "pending"
    },
    {
      "decision_id": "B05-DEC-0030",
      "requirement_key": "kit-lifecycle-02-map-md--stage-2-map-required-questions--0003",
      "requirement_digest": "c563b4b8eb351faee56aa918ff5317732cf96af06ce0b4662069c62712c34ce6",
      "adjudication_state": "pending"
    },
    {
      "decision_id": "B05-DEC-0031",
      "requirement_key": "kit-lifecycle-02-map-md--stage-2-map-required-questions--0004",
      "requirement_digest": "9a2f5c57185b6b05522284c3d5fd82b7b856a0d983c4956da8b7aadc3b431b15",
      "adjudication_state": "pending"
    },
    {
      "decision_id": "B05-DEC-0032",
      "requirement_key": "kit-lifecycle-02-map-md--stage-2-map-required-questions--0005",
      "requirement_digest": "67cfae8a53955d4c7884a4f0e125f8bfd76af4a028709e836863ff38ffce3d51",
      "adjudication_state": "pending"
    },
    {
      "decision_id": "B05-DEC-0033",
      "requirement_key": "kit-lifecycle-02-map-md--stage-2-map-required-questions--0006",
      "requirement_digest": "ebc08047c0a9828e21a1fa2d4bdb3e0e4c0e8d100ed53dea81545484f0371441",
      "adjudication_state": "pending"
    },
    {
      "decision_id": "B05-DEC-0034",
      "requirement_key": "kit-lifecycle-02-map-md--stage-2-map-required-questions--0007",
      "requirement_digest": "b1b25d452d526da02211722c7476136a16051c85eda87600d4dd5c99f8392bc3",